{
  "$schema": "http://json-schema.org/draft-07/schema#",
  "title": "Site SEO metadata",
  "type": "object",
  "additionalProperties": false,
  "required": ["description", "tagline", "image", "pages"],
  "properties": {
    "description": { "type": "string", "minLength": 1 },
    "tagline": { "type": "string", "minLength": 1 },
    "image": { "type": "string", "pattern": "^/images/" },
    "pages": {
      "type": "object",
      "required": ["/"],
      "propertyNames": { "pattern": "^/" },
      "additionalProperties": {
        "type": "object",
        "additionalProperties": false,
        "required": ["title"],
        "properties": {
          "title": { "type": "string", "minLength": 1 },
          "description": { "type": "string", "minLength": 1 }
        }
      }
    }
  }
}
